{
  "route_decision_id": "77777777-7777-4777-8777-777777777775",
  "correlation_id": "66666666-6666-4666-8666-666666666666",
  "request_id": "55555555-5555-4555-8555-555555555555",
  "resolved_approval_posture": "execute_allowed",
  "execution_allowed": true,
  "denial_guards": [],
  "review_required": false,
  "explicit_approval_required": false,
  "policy_reference": {
    "policy_id": "33333333-3333-4333-8333-333333333333",
    "policy_version": "1.0.0"
  },
  "capability_decision_summary": {
    "requested_capability_id": "44444444-4444-4444-8444-444444444444",
    "capability_admitted": true,
    "capability_owner_service": "fa-local",
    "requested_side_effect_class": "none",
    "capability_approval_posture": "execute_allowed",
    "policy_required_approval_posture": "execute_allowed",
    "requester_max_approval_posture": "execute_allowed",
    "side_effect_minimum_approval_posture": "execute_allowed",
    "review_class": "none"
  },
  "operator_visible_summary": "request is execute allowed for capability 44444444-4444-4444-8444-444444444444",
  "degraded_subtype": null,
  "decided_at_utc": "2030-01-01T00:05:00Z"
}
